Subreddit,TimeFilter,Title,Text,Upvotes,Comments,Date,Author,URL
india,year,Why can't women exist in peace at night????,"Okay, I’m literally shaking and crying in frustration and disgust. I don't even know if this is the right sub, but I need to vent or I’m going to throw something.

I’m 19F, recently done with my engineering entrance exams and finally breathing after what felt like a lifetime. Tonight, I just wanted a normal dinner hoodie on, messy bun, sneakers, zero makeup, just some peace and dosa with an old friend (guy, school buddy, not that it should matter).

We were at this dosa joint around 10:30 PM, light rain, the city felt quiet and kind for once, until it didn’t.

Three guys showed up. Drunk, loud, and already staring. I tried to ignore them at first, but the comments started. Nothing clever, just the usual grossness. One of them muttered loud enough “Rich girls like her are always looking for attention.”

It was like a switch flipped.

I told them to back off firm, not dramatic. They laughed. One of them tugged at my hoodie string like it was some kind of joke. That moment I’ve never felt rage like that in public before. The disrespect, the entitlement, the sheer shamelessness.

I stood up, plate still in hand, heart pounding. They didn’t stop until I pulled out my phone and said I was calling the cops. Of course, they ran.

The cops showed up late, asked me questions that made me feel more judged than protected. My grandparents told me to ""let it go"" and not go out so late again.

But why?

Why is it my timing, my outfit, my tone, my decision to eat outside that’s questioned, not their behavior?

I’m so tired. Not scared, just tired. Of having to be alert all the time. Of having to manage male egos in public. Of not being able to do something as basic as grab food at night without some man making me feel unsafe in my own city.

I’m filing a report tomorrow. I’m not letting this slide.

I wanted some peace for fuck sake!!!!! Got harassment instead. Welcome to being a woman in India.",1314,120,2025-06-25,jalebi_mai,https://www.reddit.com/r/india/comments/1lkdoxo/why_cant_women_exist_in_peace_at_night/
india,year,Why is religion being shoved down on us at every front ?,"Why is it that religion is shoved down on us at every front be it politics or movies or cartoons.
Why are we so obsessed with religion ?
Right from cartoons to movies, religious things are everywhere.

On cartoon channels you can see that there are cartoons for different deities. Ganesha, Krishna, Hanuman etc.

In india there have been several movies based around religion and god and there's no end to it honestly. Make no mistake i'm curious about the upcoming Ramayana starring Ranbir Kapoor but that's only because Hans Zimmer will be creating the background score for it. 

We've already made too many Ramayan themed movies and this is just another one of those.

If we come to politics then for several years Ram Mandir was literally in the election manifesto of the current Ruling Party. Religion is part of our politics.

When it comes to Ramayan and Mahabharat, we have really confused mythology with history.

During festivals, God and religion somehow become excuse for masses to create a ruckus example Ganpati Visarjan, Kanwar Yatra etc.

During saavan there was this case of certain someone shutting down KFC outlet in Ghaziabad and wanted all delivery apps to stop delivering non veg food. This was an Aggressive attempt to shove down beliefs and practices on others.

During school I remember that ramayan and Mahabharat were supplementary text books for Hindi subject in 6th and 7th class and this was CBSE textbook. I read those books with utmost interest at that time but now I don't think I really needed it.

There's no effort to encourage critical thinking in our life but yeah everyone is ready to shove down religion on you given a chance.",490,232,2025-09-12,captainrushingin,https://www.reddit.com/r/india/comments/1net30q/why_is_religion_being_shoved_down_on_us_at_every/
india,year,Why is such strong Anti gay sentiment so prevalent in India?,"
I’m 22 years old, and I’m gay. That’s not something I chose or something I can change, but it feels like every day, society reminds me that just being myself is a problem. Lately, it’s been worse. Everywhere I look on social media, in comment sections, it’s filled with hate. People make fun of LGBTQ folks, calling us names, questioning our existence, saying things that make me feel small, even though I know I shouldn’t.

What’s heartbreaking is that this hatred isn’t just random people online. It’s society at large. It’s the government. The same people who are supposed to stand for equality and rights are the ones denying me something as basic as the right to marry. I see the news, the debates, and it’s all so clear; they don’t think people like me deserve the same happiness as everyone else.

And then there’s the fear. Every time I step out or think of opening up about who I am, I hesitate. Indian society feels so hostile. People judge, gossip, and sometimes even hurt others for being different. 

It’s tiring. I didn’t ask for this fight, but here I am, trying to exist in a world that doesn’t make space for me. I can’t change who I am. I just wish I didn’t have to live in fear, constantly defending my right to love and live as I am.

Edit: Guys I did not expect such a massive outpouring of love and compassion. Sincere gratitude to you all from the bottom of my heart. 


",639,505,2024-12-24,Top_Low8758,https://www.reddit.com/r/india/comments/1hlfyn1/why_is_such_strong_anti_gay_sentiment_so/
india,year,Why I donated lakhs of rupees to random strangers?,"I've received a lot of DMs after helping a random stranger by [donating](https://www.reddit.com/r/india/comments/1h47jas/comment/lzx5ot9/?utm_source=share&utm_medium=web3x&utm_name=web3xcss&utm_term=1&utm_content=share_button) a few lakh rupees towards his father’s kidney surgery. Rather than responding to each one individually, I figured I’d make a post to explain why I did it. 

A few years ago, I did something similar—covering the entire [donation](https://www.reddit.com/r/india/comments/b7c76y/help_my_mother_for_cancer_treatment/?utm_source=share&utm_medium=web3x&utm_name=web3xcss&utm_term=1&utm_content=share_button) amount to help another stranger with his mother’s breast cancer treatment. 

Why these seemingly random acts of kindness? It’s not like I get tax benefits (being a U.S. citizen), nor do I seek fame (though it wouldn’t be hard to figure out who I am). The story goes back more than a decade. I was working at a startup, writing code in a high-rise building with an incredible view of Silicon Valley. It must have been around 3 p.m. when I got a call from my father. It was an unusual time for him to call, so I answered, panicked.""Are you busy?"" he asked.""No, Papa, tell me,"" I replied.I could sense something was terribly wrong. He couldn’t speak and broke down in tears. I didn’t know what to say.

“Papa... Papa…” That’s all I could manage. Then I heard my mother in the background: “Give me the phone, I will talk.”

My mom cries easily, but that day, she spoke calmly. She told me she had noticed a lump in her breast and that the biopsy confirmed early-stage breast cancer.

I took a deep breath. “Hmm… it’s okay, I’m coming home.”

I don’t remember much of the next 1–2 days. What I do recall is driving on US-101 on my way home, unusually aware of the speed limits. It was a survival instinct—I needed to make it home safely. You become acutely aware of life when confronted with death (yours or a loved one).

Once home, instead of immediately booking the earliest flight to India, I started searching for the best oncology hospitals. I realized finding the right doctor was more important. Fortunately, I got in touch with Dr. Kanchan Kaur at Medanta Hospital in Gurgaon. (She’s not just an incredible doctor, but also a kind and compassionate person). I flew to Delhi within 2–3 days of that call.

Over the next couple of months, my mother underwent surgery and chemotherapy. She is doing well now.

So, what does all this have to do with my donations?

The Medanta logo.

I spent a lot of time in Medanta Hospital, handling administrative tasks and paying bills. It wasn’t hard to notice the number of poor families seeking treatment at this expensive hospital—sleeping outside on sidewalks, sharing a single meal, doing whatever they could to care for their loved ones. Although my primary focus was ensuring my mother received the best treatment, I couldn’t ignore what I saw. Their struggle resonated deeply—not just intellectually, but on an experiential level. Now, anytime I see the Medanta logo, something stirs inside me. It’s hard to put into words, but I feel it deeply. If you check the Milaap fundraising post, you’ll see the Medanta logo. That’s what did the trick for me.

Today, I’m not a billionaire (in USD). But I have been fortunate enough to have founded a successful startup a few years ago. I plan to invest and grow the proceeds from my startup’s exit, and when I die, I want to donate most of it to charity. I haven’t worked out the details yet.

Moving forward, I’ve decided to shift from making one-time donations to individual strangers and instead focus on something with a broader impact. I envision creating a charity that promotes a healthier lifestyle and encourages early detection of treatable diseases. I haven’t finalized the plan, but that’s the direction I’m headed in. 

Before I end, I have one request:

Breast cancer is one of the most treatable cancers. Early detection is the key to managing it. If you have women in your family over the age of 45 (or have family history of breast cancer- it is highly genetic in nature ), please encourage them to get a mammogram.

A diagnostic test doesn’t change whether someone has cancer—but it does change how prepared you are to fight it.

",2013,111,2025-01-31,gauravphoenix,https://www.reddit.com/r/india/comments/1iehfxm/why_i_donated_lakhs_of_rupees_to_random_strangers/
india,year,Anyone else feel like Indians abroad just rebuild the same social pressures they ran from?,"The irony is, a lot of Indians leave India saying they want freedom, better opportunities, or to escape the exhausting social mindset. But once they settle abroad, they recreate the same small circles, the same gossip, the same judgments — just in a different continent.

Many Indians leave because they want better opportunities, more freedom, or to escape the social pressure. But after they move abroad, they immediately try to find other Indians and create the same kind of groups they wanted to leave behind. Same gossip, same judgments, same attitudes — just in a different country.

And it’s not just about being Indian. These people even divide themselves by language and state — Tamil, Telugu, Punjabi, Malayali, etc. The same old friction, competition, and mindset continues, just like in India. New country, same drama.

By “Indian mindset,” I mean the constant need to compare careers, salaries, marriage plans, and interfere in other people’s lives under the excuse of “care” or “community.” It’s the endless gossip, unsolicited advice, and this obsession with controlling how others live.

I stay away from all of this. I don’t go to these gatherings or cultural events divided by state, language, and religion, and I definitely don’t try to “bring India to the West.” I know that no matter what, I’ll always be seen as a second-class citizen by the natives, but at least I don’t have to deal with people stuck in that Indian mindset every day.

Sometimes I think people forget why they left India in the first place. After some time abroad, when they feel lonely, they start missing India and looking for other Indians. Then they complain that Western people are “cold” or “don’t talk to neighbors,” as if interfering in everyone’s life is somehow better.

These same people complain about how hard it is to fit in, but they make no effort to understand the language, culture, or people where they live. They just build a mini-India and then wonder why they still feel like outsiders.

What starts as simple nostalgia quickly turns into this weird idea of “we are better, we have culture, they don’t.” Meanwhile, they sit in their small groups gossiping about others, just like back home.

The truth is, they wanted freedom but can’t handle privacy. Western people mind their own business because that’s normal here. Not every stranger wants to be your friend, neighbor, or marriage prospect. That’s not cold, it’s called boundaries.

By “boundaries,” I mean the Western habit of respecting privacy — not asking personal questions, not interfering in decisions, and not treating neighbors like extended family unless invited.

And of course, many of these people live double lives. In front of other Indians, they pretend to protect “values.” Behind closed doors, they do whatever they want. Classic hypocrisy, just in a different country.

I’ve thought about why this happens and honestly, I think a lot of people just aren’t mentally ready to adapt to a new culture. They want the benefits of living abroad — better money, healthcare, infrastructure — but they still want the comfort and familiarity of the same social dynamics. It’s like people want India 2.0, not a genuinely new life.

What they don’t realize is, in the West, people value privacy, independence, and respecting boundaries. Not everyone cares where you work, how much you earn, when you’re getting married, or whether you have kids. But somehow Indians abroad still keep trying to live under the same rules and expect others to play along.

For me, moving abroad wasn’t just about changing location, it was about changing mindset. I wanted peace, privacy, and to live how I want — not another desi neighborhood committee deciding what’s “right” for me.

Curious if anyone else here feels the same. Have you experienced this? Do you avoid these circles too, or have you found any that are actually chill and not just India in disguise?

⸻

TL;DR:
Indians leave India to escape the mindset, but abroad they recreate the same judgmental, gossip-filled circles divided by language and state. They complain about Western people minding their own business while refusing to adapt themselves. I moved abroad to escape this, not to rebuild it or be part of it somewhere else.",920,131,2025-07-19,The_Prodigal_Son_666,https://www.reddit.com/r/india/comments/1m47ygy/anyone_else_feel_like_indians_abroad_just_rebuild/
india,year,Feel absolutely dejected and disgusted #VoteChori,"Today, I’m absolutely done. I knew things were bad behind the scenes and I always knew there was fraud and corruption going on but I genuinely (perhaps naively) believed that at least our voting system, the very foundation of our democracy was not compromised. 

Everyone needs to take this seriously, just running away isn’t good enough. We have such a beautiful country, so much variety and such a rich culture. How could we have let this happen? Hate politics and this demonic party has been a cancer upon our once beautiful country. Yeah, it was definitely not perfect. But I was alive for 2 decades of Congress rule and this is something different. 

I remember being young and watching comedians at 8 pm on prime time TV making fun of Sonia Gandhi and MMS whilst dressed up as them. No ED raids, no institutional bullying. I remember after 26/11 when there were resignations. At least some accountability. Where is the now? How many terrorist attacks have happened on their watch and who has resigned? 

I don’t remember r**ists being garlanded, I don’t remember this level of hatred among citizens, I don’t remember hatred being peddled openly and brazenly just for votes. It’s horrible, the air has gotten worse, the roads are terrible, the infrastructure is crumbling. Bridges are collapsing and people die. No accountability. Forests and mangroves are being destroyed, the air will only get worse. 

Our neighbours used to be our friends. The foreign policy that I myself used to praise a few years ago has been an abject failure. Now each of our neighbours is straying away from us, into China’s hands. We’re isolated in our own backyard. When 26/11 happened, Obama met MMS, condemned Pakistan, publicly stated that they need to stop housing terrorists. When Pahalgam happened what did the US president say? “Oh India and Pakistan that was a bad one, both our good friends were looking into it” and boom Pakistan got an 8bn dollar loan from the IMF (US has the heaviest vote there).  Our foreign policy is a joke. 

People rejoice over our 4tn+ dollar economy. “We’ve crossed Japan to become the 4th largest economy” they say. What are we getting from that? Who benefits? How do people live in Japan and how do we live here? What’s the per capita? And don’t tell me about population. China has similar population and 7x the per capita. Enough excuses. We have a class of oligarchs who control the government‘s decision in significant ways. Enriching themselves and keeping us poor. Company Raj never left. 

For me this was the final straw. No I don’t want to leave and run away. I love India. I’m a patriot. I can’t stand what has become of our country. Sorry I had to rant. I love all of you who read until here ❤️ whether you agree with me or not. 

",763,142,2025-08-09,shiddn,https://www.reddit.com/r/india/comments/1mlkrkc/feel_absolutely_dejected_and_disgusted_votechori/
india,year,"India Ranked State Wise:  Civic Sense, Public Safety, Gender Attitudes                                 
[India Today Survey, March 2025]",,555,325,2025-03-25,kuttoos_enn_vilicho,https://www.reddit.com/r/india/comments/1jjlhrd/india_ranked_state_wise_civic_sense_public_safety/
india,year,Reality of Make in India | Nope w/ Kunal Kamra ft. Surajit Mazumdar,"This conversation is in Hindi - Use the Auto-translate feature on YouTube.

Surajit Mazumdar teaches in JNU and specializes in Political Economy, Indian Industrialization, Indian Corporate Sector and Globalization.",11,2,2025-07-04,freddledgruntbugly,https://www.reddit.com/r/india/comments/1lrbv1z/reality_of_make_in_india_nope_w_kunal_kamra_ft/
india,year,My blood is boiling,"I’ve just lost it. What is happening to India, is there no hope. I’m taking about the stampede at Delhi railway station. Yes I know it’s 2 days ago, but as I read more the more frustrated with my life. 

I’m a developer and a founder of a traffic management app, which is something we are building to punish people who are breaking traffic rules, by increasing their insurance prices. 

I had hope to change my country, and not leave India and do masters and settle abroad like few of my country men.

 But if the value of a human life is insignificant in India. Then how can I hope to bring to this. I went to Sri Lanka last month, it was so beautiful. Good roads, people with civic sense. I want to do something for my country but I’m slowly loosing hope.

Coming back to stampede, why is this government so reckless about a life. I saw a video of a mom crying with her lifeless daughter’s body. Made my blood boil.

Why don’t people have civic sense. I’m raising my kids to follow rules and be civilised and well mannered. But people pissing, spitting, crowding, makes me feel India can never develop ",1094,160,2025-02-19,randykarthi,https://www.reddit.com/r/india/comments/1istxe0/my_blood_is_boiling/
india,year,Should Men Stop Looking at Cleavage?,"As an Indian woman, 30, married, and living in Hyderabad, I love dressing up. But it’s made me think a lot about how society sees women’s bodies—our clothes, and yes, cleavage. It’s not just a superficial issue; it reflects deeper, often troubling, attitudes.

My friend Ananya, a corporate lawyer, had an experience that really brought this home. She was on the metro wearing a V-neck kurta—stylish and perfectly appropriate. A man in her compartment stared at her chest the entire ride. She felt so uncomfortable, constantly adjusting her dupatta, even moving seats. The staring didn’t stop. She was furious, but afterward, she also questioned her outfit. Should she have worn something less revealing?

That self-doubt is something so many women experience. We’re conditioned to blame ourselves for other people’s behavior. Why should we have to police our bodies to avoid the male gaze?

**“It’s Instinct”: A Weak Excuse**

You often hear men (and it is usually men) say they can’t help but look. “It’s biology,” they claim. I remember a colleague at the hospital, Ravi, justifying his wandering eyes with, “Men are visual creatures. It’s science!” But we’re not just driven by primal urges. We have self-control.

Sure, cleavage can be eye-catching—society has sexualized women’s bodies for centuries. But a decent person knows the difference between a quick glance and a prolonged, uncomfortable stare.

**Why Do Women Wear Revealing Clothes?**

Let’s be honest: why do we wear clothes that show cleavage? Is it always about seeking attention or seducing men? Those assumptions are rooted in outdated, patriarchal thinking.

I dress for myself. Sometimes it’s about feeling confident and comfortable. Sometimes, in Hyderabad’s heat, it’s about practicality! I wear everything from sarees and kurtas to tank tops and dresses. It’s about freedom of choice.

And yes, sometimes it’s nice to get a compliment. There's a difference between a respectful glance and being objectified. Staring to the point of making someone uncomfortable? That’s the problem.

**The Hypocrisy We Live With**

Indian men often criticize women’s clothing while happily ogling Bollywood actresses in revealing outfits on screen. A colleague once asked, “Why wear revealing clothes if you don’t want attention?” I countered, “Why do you wear sleeveless gym tees? Don’t you want attention too?”

It’s infuriating. Women are expected to be both modest and attractive, traditional and modern—catering to male expectations. But when a woman asserts her independence, through her clothes or anything else, she’s judged.

We’re constantly objectified. From scooter ads to fairness cream commercials, women’s bodies are used to sell everything. Even educational institutions use images of smiling women on their posters.

This objectification seeps into everyday life. If a woman shows skin, it’s often assumed she’s “asking for it.” That’s simply not true. My clothing choices are not an invitation to be leered at or touched.

**“It’s Natural”: So What?**

It’s true, men might instinctively notice. But instincts don’t excuse inappropriate behavior. We all have impulses we need to control. You don’t punch your boss when you’re angry, do you? A man can glance and then look away.

The problem is the idea that a man has a right to stare because “she’s showing it.” She’s not “showing it” for anyone. She’s wearing what she wants, and that deserves respect.

**Feminism Isn’t About Hating Men**

Feminism is often misunderstood. Some men think it’s about erasing gender differences or demonizing men. It’s about equality and respect.

It’s important to distinguish between a fleeting glance and something like catcalling or assault. Most women won’t be bothered by a quick look, but a prolonged stare is definitely a problem.

And women, it’s okay to speak up. Saying “Excuse me, stop staring” isn’t aggressive; it’s assertive.

**The Taboo of Attraction**

Here’s something we rarely talk about: both men and women enjoy attention. There’s nothing wrong with that. The problem comes with disrespect.

In India, where anything sexual is taboo, these interactions are even more complicated. A man staring feels like an invasion. A woman dressing boldly is seen as rebellious.

Why can’t we normalize women wearing what they like and men respecting that?

**My Point**

Should men stop looking at cleavage? It’s natural to notice. But staring, ogling, or making someone uncomfortable is wrong. A woman’s body isn’t public property. Her clothes aren’t an invitation.

We need to move beyond these outdated ideas. Women shouldn’t have to dress “modestly” to feel safe. Men need to learn to control their gaze. Let’s stop blaming women and start holding men accountable.

What do you think? How do we create a society where women feel free to dress as they please without fear? How can men and women coexist with mutual respect?",557,445,2024-12-25,Zurati,https://www.reddit.com/r/india/comments/1hm4jgs/should_men_stop_looking_at_cleavage/
