Subreddit,TimeFilter,Title,Text,Upvotes,Comments,Date,Author,URL
india,year,"I hate hate HATEE this country, India and my life here","I hate this country. I hate that I was born here in India. Being born here feels like a curse, at least for me. So, for starters, I’m a 16 yr old transgender boy, born and raised in India. I have several valid reasons for absolutely despising this country from the very core of my soul. Let’s begin with the people, yep, the very proud *citizens* of India. You all know how insanely diverse this country is, right? Every state is like its own little country with different cultural practices, languages, shows, etc. But here’s a list of reasons why I think this country is a failure (there are *way* more, but these ones rlly piss me off):

1. **Extreme Pride**: So many Indians, both online and in real life, have this *ridiculous* inflated sense of pride. They believe India is superior to every other country and that it’s the absolute best. In reality? It’s not lol. They’re just too delusional to see it.

2. **Racism**: Yep, racism. Indians are some of the most racist people, *especially* towards fellow Indians. If you’re dark skinned Indian, other Indians won’t hesitate to throw disgusting, racist comments at you. 

3. **Caste System**: Can we talk about how messed up it is that we *still* have a caste system? Like, in 2025? Seriously?

4. **Lack of Civic Sense**: Indians, as a whole, lack *basic* civic sense. And no, you can’t just blame illiteracy because even well-educated, wealthy people throw trash in the streets like it’s their personal garbage bin. They’re out here littering the country and then turning around to say how “beautiful” and “better than other countries” it is. The irony is painful to say the least.

5. **Judgemental Society**: Everyone's got an opinion about you and they WILL make sure you hear it. Whether it's your clothes, career choices, gender, or who you love, you're *constantly* judged, scrutinized and looked down upon. Privacy is a complete joke here.

6. **Corruption Everywhere**: Bribery and corruption are so normal here, it's practically part of daily life. Need basic services? Better know someone or be ready to pay off some official. The system isn’t broken, it literally functions like this.

7. **Glorifying Suffering**: Struggles are romanticized here. Instead of fixing problems, people flex how much *pain* they’ve tolerated. It’s always “we survived worse” instead of “we deserve better.” It’s toxic asl.

8. **Education System:** Don’t even get me started on the education system. It kills creativity, mental health, and individuality. It’s just rote learning, unrealistic expectations, toxic competition and zero space for personal growth. Nobody gives a damn about what you actually want to do. There ain't much scope for careers like architecture, art, etc. it's always either engineer, doctor or lawyer.

9. **Queerphobia/Transphobia**: Being queer or trans in India is like asking to be treated like trash. People stare, mock, misgender, harass, and dehumanize you for simply existing. It's not just strangers, sometimes it's your own family, school, teachers, doctors. Support is rare and safe spaces? Almost nonexistent in this country. 

10. **Toxic Conservatism**: This country is too obsessed with clinging to outdated traditions and moral policing. People here act like personal freedom is a threat to society. Wear what you want? You're “asking for it.” Speak up? “You're too westernized.” Think differently? “Disrespectful.”

11. **Indians are the biggest hypocrites**: Indians L.O.V.E. preaching “respect,” “tradition,” and “values” but where is that energy when women are getting harassed in broad daylight every other day? When people are abused for their caste or identity? It's all fake, performative morality.

12. **Forced Patriotism**: You can’t criticize the country without being called “anti national.” Like sorry bro, wanting a country to be better isn’t hating it, it’s expecting *basic* humanity. But people here just don’t get that. They’d rather live in denial than face the truth.

13. **Neglected Mental Health**: Mental health is either ignored or mocked in India. There aren't enough therapists, especially queer affirming ones. Public hospitals barely have mental health professionals and private help is expensive. Plus, families often dismiss it as “drama” or “attention seeking.” You're left to fight your mind alone. That's another reason why depression and suicide rates in India are rising rapidly.

Anyway, I'm done for now. There are a lot more issues I cannot mention in this post. These were just a few I've observed and personally experienced in my 16 years of living here.

Edit: 
Here are 12 more issues I've seen because some of y'all just won't sthu and accept how flawed your country really is. Someone NEEDS to speak up. :

14. **Poverty Ignored**: India LOVES showing off its billionaires and skyscrapers, but what about the millions living in slums, without any clean water or food? Poverty here isn’t just a “developing country issue” it’s a systemic failure that both, the government and society conveniently ignore.

15. **Rape Culture**: The number of rape cases reported in India is jst horrifying and that’s *just* the reported ones. Victim blaming is so common, police often refuse to file complaints and rapists walk free while survivors are shamed and silenced.

16. **Fake Democracy**: India claims to be the “largest democracy,” but in reality? Voices are silenced, dissent is criminalized, journalists are jailed and elections are full of manipulation. It’s a democracy in *name only*. 

17. **Religious Extremism**: Religion has become a political weapon in India. Hate crimes, riots and lynchings happen in the name of faith. If you don’t belong to the majority religion, you’re automatically “less Indian” in many people’s eyes.

18. **Patriarchy Everywhere**: This society still treats women like shit, 2nd class citizens. From birth, girls are told to stay quiet, sacrifice their dreams, and prioritize everyone else. Feminism is mocked and asking for equal rights is treated like a threat still. Female infanticide still exists in several parts of India. 

19. **Lack of Accessibility**: India is extremely unfriendly to disabled people. Public spaces rarely have ramps, accessible transport is almost non existent and inclusive education is a joke. It’s like people with disabilities are invisible here.

20. **Fake Progress**: This country LOVES to brag about development but it’s mostly jst surface level. A few metro cities might look shiny, but rural areas still lack basic healthcare, clean drinking water and decent roads. 

21. **Toxic Nationalism in Schools**: Kids are brainwashed from a very young age to blindly worship the country. There’s zero room for questioning history, policies or even basic facts. You’re taught to obey, not to think.

22. **Zero Work-Life Balance**: The culture here is so toxic. People are expected to overwork, underpaid jobs are normalized and taking care of your mental health is seen as laziness like I mentioned earlier. Rest is treated like a luxury, not a necessity.

23. **No Legal Protection for Queer Relationships**: Queer people still can’t legally marry, adopt, or even access basic relationship rights. The government refuses to recognize LGBTQIA+ people as equal citizens because we “don’t align with Indian culture.”

24. **Brain Drain**: Talented people keep leaving India. Why? because the environment here is so hostile to creativity, to freedom, to ambition. If you're smart and different, this country will try to shut you down. 

25. **No Sex Education**: There’s ZERO proper sex ed in most schools. As a result, kids grow up clueless about consent, safety, and bodies leading to abuse, unplanned pregnancies, and shame. It’s a public health crisis no one wants to fix. That’s also a HUGE reason why India has such an overwhelming and unmanageable population because people aren’t taught how not to contribute to it.

**Anyway, I’m done fr now. The so-called ""Indians"" in the comments are doing a flawless job proving every single point I made. It’s honestly just embarrassing and disgusting at this point lmao.**

*Edit 2* : To those saying I should just leave India, I definitely will. I’ve wanted to for a long time. But it won’t be an escape, it’ll be a choice. Like anyone else, I just want to live a good life. I know I deserve better regardless of what other ppl have to say. If I can feel welcome and find love, freedom, safety, and acceptance in another country, things my birth country never gave me, then I’ll leave without hesitation.

*Edit 3* : And to those saying my post was written by AI, I appreciate the accidental compliment lol. I guess my writing’s finally leveling up! 
",3139,771,2025-04-05,Apprehensive_Deer906,https://www.reddit.com/r/india/comments/1js8tr1/i_hate_hate_hatee_this_country_india_and_my_life/
india,year,"I took an education loan of ₹40L to study in the US — now I’m back in India, drowning in debt, and don’t know what to do","Hi Reddit,

I never thought I’d be in a position where I’d have to write something like this, but I’m out of options and just hoping someone out there can guide me or help.

I’m from India, I took an education loan of ₹40,00,000 from HDFC Credila to pursue my Master’s degree in the U.S. My father ran a small business and, along with my family, they put in a lot they had — emotionally and financially — to help me chase the dream of a better future.

I completed my degree, but due to the economic recession, visa limitations, and lack of internship opportunities for Indian students, I never got a job in the U.S. I applied relentlessly for a year, but couldn’t even earn enough to cover my own living expenses. My family sent me money every month — draining their last savings.

Eventually, my father’s business was making losses and he fell ill. They couldn’t support me anymore, and I had to come back to India, heartbroken, jobless, and with a huge loan on my head. (Update: He’s better now and healthy)

⸻

After months of searching, I finally landed a job here in India that pays me ₹75,000/month — but my EMI is ₹66,000/month. That leaves me with just ₹9,000 as personal savings, now the business is running and it can support the family, and handle everything else. I’m trying to pick up extra freelance or part-time work, but between my day job and my father’s aging, I’m emotionally and physically drained.

I feel like my whole life will go into just surviving this crisis. We were a modest middle-class family.

⸻

I don’t know who to turn to anymore. I’m trying to contact the bank for restructuring, applied for side gigs — but nothing has worked so far. That’s why I’m here: asking Reddit for advice, guidance, or if anyone knows how to navigate the next steps further.

If you are / know any hiring manager, Recruiter who can get me an interview at a good company that would be super helpful, feel free to DM me.

I feel confident on my skills that I can crack the interview if given the opportunity. 

I did my MSc in Management Information Systems, Undergrad is in IT. I have a couple of years of work experience doing Tech Product Management, Project Management, AI consulting, Marketing and Sales.

Let me know if you have opportunities in these domains. 

If you’ve been through something similar or know someone who can help — even just to talk — I’d be immensely grateful.

Thank you for reading this far. Just being heard means a lot.

🙏",3111,707,2025-03-28,theTechPhilosopher,https://www.reddit.com/r/india/comments/1jlwg2z/i_took_an_education_loan_of_40l_to_study_in_the/
india,year,Indian Tourists in Vietnam,"I just came back from a ~2 week vacation from Vietnam and I was shook by the behavior of some Indian tourists there. Really need to vent this out, hope this is the right place.
Might be a long read, I am not filtering out or articulating.

For starters, I'm from India and I'm proud to be an Indian, I love the culture, I love the love we have, I plan to stay here for the long term even though I have enough leverage and opportunity to move out, simply because nothing can replace the feeling of being here.

For context, I went for a ~2 week tour in Vietnam very recently and just came back. It was a really good trip, there was decent footfall as tourist seasons peak in most of the places that I have been. And of course, there were a lot of Indian tourists coming with families majorly.

Most of it was smooth, but there were some things which irked me so much that I almost felt embarrassed to be put in the same pool as these people.

I don't want to go into any specific religion/language/set of people so I'll keep this generic, and I mean no offence to anyone.

First off, we took a small bus tour in Da Nang to visit Hoi An and Marble mountains. There is this group of 8-9 odd people, an Indian family which takes up the majority of the bus. They have 0 regard for the silence or peace of anyone in the group. Since they were a big family, they didn't get seats together. That ended up becoming a reason for them to stand/shout throughout the journey. EVEN WHEN THE GUIDE WAS TRYING TO SHOW US AROUND AND SPEAKING IN THE BUS. There were people from all nationalities, German, Americans, Australian, Taiwanese, and all of them were visibly irritated.
On top of this, one of the guys telling the guide to stop the bus somewhere for ""garam chai and pakode"" as it was raining, thinking this was funny whilst the guide being confused as english wasn't his native language and people struggle there.

It was clear that we'll be served Vietnamese food as part of the meal and they had separate provisions for Vegetarian Vietnamese food as well. But when that family reached the restaurant, they created a ruckus about the food and decided to leave. They told the guide to pack up the food and they'll have it later at their hotel. The guide packed 9 boxes of food and in the end of the tour, when they were getting down they left the food there saying ""ye sab kon khaayega, hum jaake daal makhani aur roti mangaa lenge"". WHAT? Why the fuck will you tell them to pack food when you knew you wouldn't want it.

Apart from this, in the last leg of the journey, they opened up chips, khakhras and what not, creating a ruckus on a 1.5 hr drive from Hoi An to Da Nang. They ended up throwing packets in the bus, spilling food and putting it up in the mini-bus pouches and trays.
When in the end I told them to atleast pick up and not trash the bus, they said and I quote ""Arre agar ye hum yahaan choddke naa jaaye toh pata kaise lagegaa ki Indians aaye the ghoomne"". 
This was the point when I REALLY wanted to smack them in the face.

Apart from this, so many places where I saw Indian tourists being extremely loud, without giving 2 fucks about their surrounding. Also gathering and eating food in places where you're clearly not allowed to (I get dietary restrictions, I am an eggetarian as well, but there's a place and time to open up your own food packets).

Also, so many times when in group tours, they'll keep the whole group waiting even when the time to gather back is clearly mentioned because they overestimate their direction sense and speed, and always want to capture everything on their camera(nothing wrong, but do it in the time frame)

This one time this husband and wife came in 7 mins late, then the guy had the audacity to step back down for one more selfie with his wife because they saw a statue on the other side. Even the tour guide was absolutely frustrated.

Another problem is people not understanding their health limitations for activities. These people get tours and vacations booked from travel agencies, whose purpose is to sell them the most activities.
They almost never do their own research as to what is feasible. We were in Hang Mua caves, which is a fairly physically challenging hike for people who are not in the best shape. We had old Indians who were trying to climb up but it was clearly not cut for them.
I really want them to hike up and wish for their good health, but some things are a stretch and there is always a line that you should be able to draw, especially if you're bounded by your own health. There's only a single file of people who can go up, so if you're slow/stuck, the entire line gets stuck. This one very passionate Indian uncle in his 70s was really struggling but was hell bent on covering it, even though everyone was suggesting him otherwise.
This isn't his fault, but doing some research and choosing the places you visit according to it is something which I have seen a lot of Indian tourists lacking. Primarily because a lot of people don't go to a country to experience it, but rather to mark it off their to-do list that they've visited one.

Also random but this one Indian uncle singing loud bhajans whilst in a boat and saying ye sab to India mein hai, ye sab dekhne thodi aaye hai whilst belittling people around, under the pretext of humor.

I cannot tell anyone to experience the city, research, try local culture, food, that's their choice, whatever floats their boat.
But please, please make sure that you're not a bad influence on the image that people have about your country. 
It doesn't take too much to be a little civil, a little less loud, showing some respect and better habits. We boast about being extremely hospitable, it'd be good if we don't come off as loud, arrogant pricks everywhere we go.

There's always a set of very well behaved Indians who guides love to interact with, talk to and joke around with. We had some really really amazing experiences.

But there's something fundamentally wrong with some people and I hope they realize it before we are all categorized in that pool.",4275,828,2024-12-17,suffer-surfer,https://www.reddit.com/r/india/comments/1hg7k14/indian_tourists_in_vietnam/
