Subreddit,TimeFilter,Title,Text,Upvotes,Comments,Date,Author,URL
india,month,Looking for reformatory institutions / military schools in India for a severely misbehaving teen,"Hey everyone,
We’re looking for guidance on institutions in India that can help rehabilitate a highly difficult teenager — ideally structured environments like reformatory homes, military boarding schools, or similar setups.

My 14-year-old brother-in-law has been formally diagnosed with ADHD + Oppositional Defiant Disorder. He is adopted and lives with elderly parents who are finding it impossible to manage him.

There’s a history of repeated aggressive/defiant behavior — getting into trouble, stealing money at home, and mixing with the wrong crowd. We’re worried he’s headed toward more serious issues, and we want to intervene before things go bad.

We’re desperately looking for:
1) Military-discipline schools ( or ) 
2) Reformatory/behavioral intervention institutions. ( or )
3) Rehabilitation-focused boarding setups
4) Any NGOs / govt programs that work with such teens

Location is flexible. If you have any leads, personal experiences, or contacts, please comment or DM.
We’re trying to make sure he gets the right structure and support before things escalate.

Thank you 🙏",0,21,2025-11-02,lotofthought,https://www.reddit.com/r/india/comments/1ommbl1/looking_for_reformatory_institutions_military/
india,month,tired of complaining how broken our cities are,"every day i scroll through the news and it’s the same thing. accidents, rapes, murders, broken roads, garbage, people living in horrible conditions. it’s like there’s no end to how bad things can get here. it honestly messes with my head sometimes.

the stress of daily life is constant. pollution, dust, noise, traffic, unplanned construction. nothing feels easy. i feel powerless most days.

i did my undergrad in sydney and that was the first time i saw how a city can actually work. you don’t need a car. public transport just works. there are parks, plazas, beaches, markets that are clean and safe. people follow rules. public spaces are respected. it all felt so natural.

but still, i came back. because sydney never felt like home. i missed the food, the people, the chaos, the culture. i missed that sense of belonging. but when i came back, reality hit hard.

the roads, the trash, the corruption, the disregard for rules, it all just gets to you. i kept ranting about it to anyone who’d listen. and every single time, i’d get the same line.

“Yeh India hai, yaha sab chalta hai”

and maybe they’re right. anyone can complain. but if you really care, you should do something. that line has been stuck in my head for a while.

i’ve been lucky. i don’t have to worry about money before making most decisions. i know that’s a privilege. and i think i owe it to myself to use it for something that matters.

i love jaipur. i love its history, the architecture, the food, the energy. but i want it to be more. i want it to be a city people are proud of. clean air, proper drainage, working public transport, walkable roads, functioning infrastructure. basic things that shouldn’t feel like a luxury.

for years i’ve been voting but never for someone i actually look up to. always the least worst option. i’m tired of waiting for a young leader to show up and speak our language. so i’ve decided to at least try to be that voice myself.

i’m an introvert and i know this will take time. i’m thinking of starting small, probably here on reddit, maybe later on youtube or wherever people my age actually listen. just starting conversations about the issues that matter and what we can actually do.

if things go well, my long term goal is to run for mla from malviya nagar in 2028. i don’t know if it’ll work out, maybe it won’t. but i’d rather try than spend my whole life regretting that i never did anything.

i’ll stay anonymous for now. even my family laughs at the idea of me doing something like this. but hopefully over time i’ll grow a thicker skin.

i just needed to write this somewhere. it’s been sitting heavy on me for almost a year now. i feel a bit lighter after typing it all out.

if you’ve read till here, thank you. i’m sure some of you feel the same way. tired, frustrated, angry, but still in love with this place. i don’t know if we can change everything, but maybe we can start somewhere.",20,17,2025-11-03,Pitiful_Bluebird4843,https://www.reddit.com/r/india/comments/1ongrmg/tired_of_complaining_how_broken_our_cities_are/
india,month,Moving to India from the US with a clinical psych PhD?,"Currently in a long distance relationship with me in the US and partner in India. My partner’s job is highly localized, so I have more flexibility to move. I’m currently doing a PhD in clinical psych in a top 10-20 university in the US, and want to get a sense of success if I move back to India (I’ve grown up here when younger). I’ve already won national recognition for my work, and don’t have any doubt of my success in the US. 

Will I be able to succeed financially in Mumbai with my degree? What is the licensing process?  I’m assuming there’s no real scope to continue the research I’m interested in, giving politics and lack of general funding. Any advice would be helpful. 

I know that it makes more sense to continue to stay in the US, but I also want to give my long term relationship a chance if there is one. This is a very emotionally difficult situation overall, so please be kind and let me know what all I can do. 

I’m very good at psych research, stats, clinical work (just starting though) etc. so I’m not concerned about skills. I won’t be able to give therapy in Hindi/Marathi or anything, I’m not as fluent there professionally fully but perfectly good mixing languages in with English. I’m assuming I would cater to a more upper class background therefore, but want to do pro bono/outreach work for others as well. I’m a very dedicated and ambitious person either way! ",7,17,2025-11-02,ihavesomquestions,https://www.reddit.com/r/india/comments/1omq51m/moving_to_india_from_the_us_with_a_clinical_psych/
india,month,"While we choke on smog every winter, greenhouse gases aren't even legally classified as ""pollutants"" in India","Another year, another smog season, Delhi's AQI crosses 400, no one can go outside, and life goes on. Delhi govt will start its rant about farmers in Punjab/Haryana who will blame it on cars and thermal plants till someone smart comes and put it all on Pakistan and next year we play the same game.

I was going through research on environment law in India and read this fantastic paper that shows why things will not be improving in India anytime soon. 

To start with, irrespective of what govt says, about its work on cleaner air, Greenhouse gases are legally NOT classified as pollutants in India. The National Green Tribunal explicitly ruled that greenhouse gases like HFC-23 are ""not a pollutant or a toxic gas which is harmful to human health."" They're just greenhouse gases, which apparently is different.

This matters because the Environment Protection Act 1986 and all our air quality laws only regulate ""pollutants."" This means you literally cannot challenge a coal plant or any major project under environmental law based on its greenhouse gas emissions.  So while we're gasping for air every November, the legal system doesn't even recognize the gases causing long term climate change (which makes smog worse) as something that needs regulating. Farmer burning stubble are also not immune from damage they cause, the unseasonal rain this time around harvest season has ruined a lot of crop. 

And, this is just the tip of the iceberg, between 2018 and 2023, the central government made over 100 changes to environmental clearance rules. Not through Parliament, just notifications, allowing them to rewrite the entire framework whenever they want. One change lets them declare any project ""strategic to national security"" and exempt it from public hearings or disclosure. Another lets illegal projects get retroactive approval, plain corruption 101.

A University of Surrey study just analyzed how Indian climate law actually works and found that the entire legal framework is designed to NOT hold anyone accountable for emissions. Environmental law doesn't cover climate and climate commitments under Paris Agreement aren't legally binding here because Parliament never ratified it through legislation.

The big picture environmental and climate framework is that it's designed to look like we're doing something while ensuring nobody can actually be held liable.

Every winter we blame farmers burning stubble, we do odd even, halt construction, buy air purifiers, and tell people to stay indoors. But the legal system is structured so that the biggest emitters face zero consequences.

And we wonder why air quality is a crisis every single year.

Source - [https://openresearch.surrey.ac.uk/esploro/outputs/journalArticle/Conceptualizing-Climate-Law-in-India/99892365302346](https://openresearch.surrey.ac.uk/esploro/outputs/journalArticle/Conceptualizing-Climate-Law-in-India/99892365302346)

If you are concerned about the envrionemnt, do give this paper a fantastic read, and start raising the right questions, the govt responds when we pressure them, the GST relief came once people started making noise on social media, this too can work, but we need to be focusing on the right questions and not get lost in the blame game. ",86,9,2025-10-23,Super_Presentation14,https://www.reddit.com/r/india/comments/1odwxic/while_we_choke_on_smog_every_winter_greenhouse/
india,month,I am an alien in my own country. And so are my parents.,"What I am about to share here is something I have kept close to my chest until now. Because, unfortunately, I have tried to deal with this on my own, but I have realized I am no longer capable of doing so. I have also realized that my family and I have been facing this issue for far too long and keeping silent about it isn't doing us much favor.

For all intents and purposes, I will be keeping my identity and my parents identity a secret. However, this is a story that my parents and I have experienced for quite some time.

  
I was born in Hyderabad. Based on what my parents mentioned later in my life, conceiving me was a decision they took after coaxing from their parents. The relation between my parents and my grandparents wasn't great. 

My grandfather favored other relatives over his own children and this caused a lot of friction between my parents and my grandparents. Eventually, when my father realized he was being manipulated and coaxed into joining a business by his parents, he and my mom distanced ourselves from them.

So, for me, the only people I could depend on were my parents. Because I was an introvert by nature, I couldn't foster any friendships when i was in school. Even the few i had was due to group projects and homeworks. 



So, with what little resources they had, they still manage to give me the education needed to get a decent job. I graduated from Regency Institute of Technology, Yanam in 2018, when it was still open. Got a Bachelors degree in Electrical and Electronics Engineering. This institute was affiliated to Pondicherry University, so when the institute was closed down, my degree remained valid. 

However, keep in mind that for all this time, my parents could only afford the bare minimum and had to rely on what they had earned in their prime. So, this meant that for almost 15 years, we ended up living in Urban villages like Ghitorni, Yanam, Shaheen Bagh (when I got a KPO job in Noida), and so on. Not to mention that we couldn't afford buying any high end equipment or house during this period.

  
In 2019, I felt like things were finally going to be better when I got selected in an off-campus drive conducted by Infosys. We even opted for going to Mangalore so that our expenses would stay low. 

  
Nothing really changed. On the contrary, it got worse.

  
Since my parents were unable to earn anything and their health condition was getting worse, I had to handle all the expenses since 2019. This meant I had to take loans and credit ever since I got my first salary. What made things worse was the pandemic where we were forced to stay in a poorly maintained 1 BHK in Kaikamba for 2 years. While dad's life insurance policy matured in 2022, it only gave us a temporary respite as he only got enough to last us for a year. 

  
I have since worked in 3 projects as a Systems Administrator managing Linux servers and cloud environments for other clients of Infosys. However, the problems still remained the same on personal side of things.

  
My parent's mental health condition had also started to deteriorate as they couldn't find anyone who can understand their situation and offer a helping hand. On the contrary, everyone around us acted like we were some rich people ready to be taken advantage of. Anytime my dad said, ""My son works in Infosys as such and such...."" the immediate response was ""Oh! So you must be earning a lakh per month at least."" or ""You must be doing quite well then.""

My starting salary when I joined as a fresher was around Rs. 20k which only doubled recently, i.e., after 6 years. I couldn't shift to any other company because I was already taking  advances and loans continuously to make ends meet. Not to mention my parents medical needs. 

What also infuriates me is that we have shifted to multiple states, hoping that somewhere we could get a better quality of life. Despite my increase in salary and despite paying for a 1 bhk in a gated society, the water quality remained horrible. We constantly have to rely on buying Bisleri, the ONLY bottled water company in India that sells 10L and 20L water can.

I say ONLY because any other local water company has had a worse water quality compared to Bisleri. Even Bisleri cans differed between states. 

We couldn't afford raising a legal case or a court case against this as we just didn't have enough time or money to spend fighting this battle. Plus, my father and I are already aware of how futile our justice system truly is and how little it really cares about it. If you don't have enough money to pay for a trustworthy lawyer, you will only end up paying more than what it's worth. 

Ajnara Le Garden, one of the societies we have lived in, has a severe case of improper maintainence. This was back in 2023. Due to the leakage of pipes and construction taking right next to our society, it was far from an ideal place to live in. Yet, I have seen so many people just live their lives not knowing what they are actually suffering through.

  
We have taken countless measures of keeping ourselves safe. Water filters, disinfectants, mosquito nets, you name it. To even avoid dealing with delivery associates who didn't follow the normal behaviour of hitting the bell once, I had to go out of my way to coordinate with him and pick the package from the lobby. JUST to avoid conflict. 

  
Yet, none of these measures made any of our lives better. We have been trying to leave this country since the past few years. In that process, my parents have sold off the furniture and even discarded any belongings they had. Whatever jewelry we had was sold off long ago. 

Despite these sacrifices, I have been unable to help them move away from here. And unfortunately, I have tried asking for help but when everyone else around you are going through similar or worse situations, what can you do? I have also tried getting a freelance gig outside my area of expertise, i.e., by working on video editing jobs but all i could come across were fradulent job postings asking you to pay money just to get the job.

The most common suggestion that was given to me was ""Talk to you HR!"". As someone wise once said, the HR only cares about the welfare of the company, not you! They would only be responsible if your welfare affects theirs directly. Even then, I have tried. That resulted in me apologizing for asking assistance.

  
Of course, when I try to ask someone else outside of my workplace, they think I am trying to scam them and begin to distance themselves away from me. 

The whole point of being in a country and having a community is that we share our burden. Our issues. If we no longer do that, then what are we? My father used to share tales of his great grandfather having a great life with just a few Anna's. Nowadays, you cannot manage a week without Rs. 10000. Rs. 5000 if you're living in the suburbs.

  
I want to keep fighting and trying to get my parents to a better place where they can live the rest of their lives peacefully without facing the hassles they are going through now. I am prepared to sacrifice my life should that opportunity arise. But that is unfortunately not the case.  I have, indeed, become an alien in my own country because the people around me have turned a blind eye against what we face in our daily lives. And despite everything, I cannot find the opportunities that would help me escape this abyss. At least, that's how I feel. I'd like to know if any of you have gone through what I or my parents have gone through. It would also be helpful if you could tell me how you got out of your own abyss.",13,16,2025-10-31,Financial_Money3540,https://www.reddit.com/r/india/comments/1okqd3r/i_am_an_alien_in_my_own_country_and_so_are_my/
india,month,"SpiceJet offloads all passengers’ baggage from Patna–Hyderabad flight SG875, again. Airline admits delay of two more days.","I don’t usually post here, but this one deserves attention.
I was on SpiceJet flight SG875 from Patna to Hyderabad on 29 Oct, and the airline offloaded everyone’s baggage at Patna airport without informing a single passenger.
To make it worse, they had sent automated check-in messages confirming that baggage was loaded. Everyone trusted that notification, only to find at Hyderabad airport that not one bag had arrived.

Passengers panicked many had connecting flights, some had medicines, essentials, or work equipment in their luggage. Airline staff at Hyderabad had no clue, no announcement, no apology.

When I called their team, they casually said, Your baggage will be delayed by two more days.Initially, we were told the bags would be sent and delivered by 30th October evening. Now they’ve just pushed it further without any explanation.This isn’t even the first time the same flight did this yesterday too. It’s clearly not an accident; they knew what they were doing.
Honestly, I booked SpiceJet because I had no option left I know how they’re barely holding on, working in collaboration with Czech Airlines and already deep in losses. But this is beyond poor management. It’s outright irresponsible and unethical.

@flyspicejet@DGCAIndia @MoCA_GoI @RamMNK

#SpiceJet #IndianAviation #PassengerRights #HyderabadAirport #PatnaAirport #TravelIndia #AirTravel #MoCA_GoI ",85,8,2025-10-30,LowNefariousness9231,https://www.reddit.com/r/india/comments/1ojq72k/spicejet_offloads_all_passengers_baggage_from/
india,month,Figuring out India in baby steps,"Married to an Indian (Northern) for years, Im still struggling to explain some mysteries of the Indian life/culture that my husband failed to give an answer that makes sense:

1. why are cooking tools (knives and chopping board and peelers, scissors) are either not working, dirty and rusty with sticky substances- probably food residues, or extremely unproductive in the households' kitchen? The saucepan's lid has no handle/knob or the lid itself does not exist and some random plates would be used and require our hands to be exposed to direct boiling steams and risks of burning. It's unsafe, inconvenient, and unproductive - but why hasnt this changed? Why would the women accept spending more time in the kitchen due to poor tools that takes minutes to fix/changed so they can save time to rest or do their favorite things? Is it a reflection of the women's lower status in the (particular) society compared to their men counterpart?

2. Are most of the kitchens lacking microwave? Is it because of the metal plates and dinnerwares' propularity? Why are they even popular while they're so hot to touch while having the hot food, and of no beauty? Why are the upper kitchen cabinets usually partally/completely missing from the Indian kitchens I've visited while the home clearly needs more storage for the random kitchen-related things here and there?


3. Would you consider your hometown/society's general household hygiene standards lower than what you prefer/what you think it could and should be and why hasnt it been changed to meet what you prefer? As in hygiene, I meant the lack of toilet paper, almost non-existence of paper napkins, surfaces/counter/cabinet in the kitchen with oil residues, clothes always in eye-popping dye colors that fade to other people's clothes too, the careless dripping when pouring or distributing food/ not closing bottles and boxes tightly so food goes bad quickly, the lack of processing of ingredients before cooking like NOT taking our rotten/unusable leaves of herbs or peeling of some root veggie or pumpkin, the dark nail corners of people of older generations which definitely also comes in the food they eat by hand, colanders are not popular so no deep-water washing and the washing under the running tap doesnt remove all dirts, etc... 

4. What does it take to move a household's lifestyles towards more civilization/ convenience/ productivity, besides money - in your opinion or experiences? Have you ever seen a drastic upgrade in lifestyles (hygiene and the way people cook/eat) and what conditions enabled that?
We've doubled my in-law's income and these have not improved so I guess there are other underlying obstacles I need to solve first.

For context, we (since being together) has not lived in India, only East Asia and North America. My husband left India 10 years ago and is not good at articulating thoughts/ cultural analysis or observation - or he might be just insecured about admitting some ugly facts. During his childhood, his family also moved from place to place due to his father being a ""para-military"" officer so he has no ""deep root"" to a place/society like others.

I've never lived in India, only visiting and for a total of 45 days of all the trips to India in my life. Im concerned about these things because I want to understand/interpret them in a way that bridges my culture (where these things are considered bizzare and undesirable/unacceptable) and the Indian values that those things represent, so that I can teach my kids to accept/ appreciate both cultures which are sometimes conflicting. 

Please excuse my curiosity/ approach from another culture that differs so much from yours. I sincerely thank you for your patience and help to explain any of these isses to me!",0,15,2025-11-01,Which-Dragonfruit388,https://www.reddit.com/r/india/comments/1om0408/figuring_out_india_in_baby_steps/
