Subreddit,TimeFilter,Title,Text,Upvotes,Comments,Date,Author,URL
india,day,Gender neutral child care leave for government employees,"Recently I had a long discussion in one post about the 730 days paid child care leave of central govt which generally only women get and why it should be gender neutral. So thought of making a post on this. All the countries including India had been patriarchal where it was thought that household chores and taking care of child are only women’s responsibility. Afterwards many countries have extended parental leave for fathers (often called paternity leave or shared parental leave) for many reasons, such as,

1.  Encouraging fathers to take leave helps balance caregiving roles between men and women.

2.  It reduces the expectation that only mothers should stay home, supporting women’s career continuity and reducing workplace gender bias.

3. If fathers are allowed to take leave and mother have private jobs where long leaves are not allowed, mothers can return to work sooner and face fewer career penalties.

4. Involvement of fathers strengthens the emotional bond with their children.

5. Fathers can stay home when needed and can be more engaged in childcare. The children raised in such environments grow up understanding that caregiving is not solely a mother’s responsibility. This helps shape future generations with more balanced and less patriarchal mindsets.

6. For years, women have been forced to step back from their careers to care for their families, leading to an unfair perception that they’re less reliable employees. When both parents share responsibilities equally, women get the freedom to pursue their careers with confidence.

7. It encourages a more balanced work-life culture. 

8. It promotes a modern family model where both parents share duties equally, reflecting current social values.

The generation is changing and so is the mindset of people. Now men are also happy to take care of the family. Many men even want to be a single father. There can be widowed father with a child. So gender neutral care rule will not only help more women but also such single fathers. ",19,35,2025-11-13,Complex_Command_8377,https://www.reddit.com/r/india/comments/1ovw9kk/gender_neutral_child_care_leave_for_government/
india,day,"I asked chat gpt if dr. Shashi tharoor is capable of becoming a pm , here's what he said","Bro Shashi Tharoor as PM would be hilarious AND kinda elite at the same time 😭🔥.

Here’s the straight-up breakdown, no fanboying:

Strengths (and they’re solid):
• Dude actually has a brain. Not the WhatsApp University type… the actual Oxford-UN type.
• Global diplomacy? Man would charm half the world into giving India trade deals just by using words nobody understands 😂.
• He’s modern, secular, and policy-oriented. India desperately needs that mix rn.
• He won’t treat the economy like a school project. He actually gets economics.

Weaknesses (and these matter):
• Bro’s biggest enemy is his own party. Congress would rather eat mud than make someone competent their leader.
• Mass appeal? He’s respected, but he’s not “rally crowd madness” material. Aunties love him, intellectuals worship him, but he doesn’t have that raw street power.
• His English scares half the country. Some people just hear his vocabulary and faint 💀.
• He’s too clean and too diplomatic for today’s hyper-chaotic, hyper-aggressive political ecosystem.

Would he be a good PM?
Lowkey yes. India needs a smart, calm, globally respected leader who won’t talk like a TV debate host.

Will he actually become PM?
Bro that probability is lower than Indian trains arriving on time 😂.

He’s the right leader for the wrong political climate. The country vibes with muscle-flexing, not refined governance.

If India ever shifts toward mature, policy-driven politics, Tharoor is S-tier.
Until then… he’s basically that legendary character in the game that everyone loves but nobody actually picks.",0,20,2025-11-13,Glad_Objective1318,https://www.reddit.com/r/india/comments/1ovr5ml/i_asked_chat_gpt_if_dr_shashi_tharoor_is_capable/
india,day,"Injustice Everywhere, Yet We Keep Voting the Same – When Will India Wake Up?""","
In India, everyone knows injustice is happening.
Everyone sees corruption, scams, and crimes happening in front of their eyes.
And yet, when the time comes, the same people are voted back into power.
Then how the hell will any change ever come?

Every robber knows he’ll be saved.
Every corrupt official knows the system will protect him.
Politicians are looting public money openly — and still roaming free.
The public? They show outrage on social media for 2 days and move on.
Nothing changes in real life.

We talk about karma, but where is karma now?
If karma truly existed, half the people destroying this nation would have faced consequences long ago.

And people say, “What can I do?”
Arre bhai, if one and one join, it becomes 11, right?
Change doesn’t come from one person — it comes when each person decides “enough is enough.”

Creators make videos exposing scams, corruption, and injustice…
They get views, likes, followers — and that’s it.
No real action. No real change.
Everyone is part of the problem but no one wants to be the solution.

Look at Singapore — they changed themselves and made a massive comeback.
Strict rules, zero tolerance for corruption, and respect for citizens’ money.
Why can’t we?

From traffic police to top officials, corruption has become a chain —
And the ones who try to be honest? They’re silenced or killed.
What’s the point of such a system? It’s all puppets and power games.

Sometimes, I genuinely feel AI might do more justice in India than humans do.
At least AI won’t take bribes.
At least it will treat everyone equally.

Until the public wakes up, until we unite and stop being silent spectators,
Nothing will change.
And the sad part is — we all know that.

It's just my pov and my opinion ",23,12,2025-11-13,sidsolanki7,https://www.reddit.com/r/india/comments/1ow2uv4/injustice_everywhere_yet_we_keep_voting_the_same/
india,day,"I found my childhood diary, kinda broke me","I was organizing my books today and found an old diary.  
In it, little me had written ""I want to become a Prime Minister of India""  
When I was kid teachers and relatives used to ask me, ""What's your ambition?""And I'd proudly say, ""Prime Minister of India"" - without even knowing what the position actually meant.  
I just wanted to change the country, make it equal irrespective of gender. Fair and happy for everyone. Funny thing is, My first thought about feminism started there at young age. But somewhere along the way that fire just disappeared.

Now when I wonder today's politics and leadership ""Why are there still so few female leaders even in so called developed country like USA""  
Why does modern feminism more focused on lifestyle freedom - dress,drink,dating than on leadership and governance?  
Why aren't we fighting for women to be in position that can actually change the system instead of surviving them?  
And the worst part? Crime rate against women keep rising. Whom to blame? Government? Society? Men? No..... They blame the victims.

I'm not saying only women should rule. But imagine if the country had two heads of state - one male one female - leading together. Balancing empathy with strategy, emotion with reason. Wouldn't that be interesting?  
I Know it's not simple. But I miss that kid who thought changing the world was possible.

My question to girls:  
If you became the leader of country - What will you do? How will you transform the nation and citizen?",4,8,2025-11-13,hazir_26,https://www.reddit.com/r/india/comments/1ovtptf/i_found_my_childhood_diary_kinda_broke_me/
india,day,Why 3 wheel bike in India Deserves More Respect,"I’ve always been fascinated by bicycles and unconventional modes of transport, and recently my attention turned to the 3 wheel bike in India. These vehicles often get overlooked or stereotyped as something only laborers or small vendors use. But in reality, they’re a practical, low-cost, and eco-friendly option that more people should consider.
When I started asking around about owning one, opinions varied wildly. My neighbor suggested it wouldn’t make sense to spend money on something so “basic” and hinted that a second-hand scooter would be a more respectable choice. I get where that perspective comes from, the social stigma around non-motorized or three-wheeled transport is real. Still, that doesn’t change the fact that these bikes offer autonomy, require no fuel, and can handle crowded city streets in ways larger vehicles can’t. I even browsed Alibaba out of curiosity to see what models were available and was surprised at the variety and affordability. The 3 wheel bike in India isn’t just for short-haul vendors; it can genuinely serve as a commuter vehicle. If more people embraced them, roads would probably be safer for cyclists, and environmental impact would drop. It’s time to rethink how we view the 3 wheel bike in India, not as a poor man’s ride, but as a smart, sustainable choice for anyone willing to try.
",7,2,2025-11-13,pinkydilemma54,https://www.reddit.com/r/india/comments/1ow5vcj/why_3_wheel_bike_in_india_deserves_more_respect/
india,week,Why is it almost impossible for a foreigner to get a sim card in India?,"Just landed in Mumbai and spent 3 hours trying to sort out a SIM card situation. This has to be one of the most tourist-unfriendly things I've encountered.

First off, barely any SIM card kiosks at the airport. Like, seriously? This is a major international airport and there's maybe one tiny shop that's sometimes open. Most other countries have multiple carriers competing right when you land. Here? Good luck even finding where to buy one.

Then when you finally find a place, they hit you with the requirements. They need a LOCAL ADDRESS (why local, why not my own from my ID). I literally just got off the plane. I'm standing at the airport. Where am I supposed to get a local address from? And apparently some places want a LOCAL PHONE NUMBER as a contact. How does that even make sense? I need a phone number to get a phone number?

The whole process is insane tons of paperwork, documents, verification steps. And THEN they tell you ""oh yeah it'll activate in 24 to 48 hours, maybe 72."" I'm only here for a week! What am I supposed to do for the first few days, just wander around with no way to contact anyone or use maps?

I've been to like 15 countries and never had this problem. Thailand? 5 minutes at 7-Eleven. Japan? Vending machine at the airport. Singapore? Multiple booths competing for your business the second you clear customs. India? Nah, let's make it as complicated as possible.

The weirdest part is India has over a billion phone users but somehow makes it nearly impossible for visitors to actually get connected. It's 2025 and I can't get basic phone service without jumping through hoops like I'm applying for a visa.

Anyone else dealt with this nightmare? Please tell me there's some workaround I'm missing.

( I know about E sims and International Roaming, I Just want to know whether there is better way of getting an Indian sim and my situation is a rare case)",2044,463,2025-11-09,sidhoax,https://www.reddit.com/r/india/comments/1osc9rq/why_is_it_almost_impossible_for_a_foreigner_to/
india,week,"A Cautionary Tale for Foreigners in India Visiting the FRRO in New Delhi, Do Not Expect to Be Treated as Anything More Than Subhuman.","A warning to all foreigners in India who may seek assistance from the FRRO office in New Delhi: Expect to receive little to no help if there is any nuance in your situation. 



My partner and I were instructed by the SDM office, Daryaganj to gain clarification regarding her passport and visa so we travelled to the FRRO office located in New Delhi. 



We were greeted in the office by the officer situated at the desk shouting at an elderly couple. Their error? Daring to ask why they were being denied exit from India and being forced to apply for an exit permit. The older gentleman stated that to solve this issue, he needed to understand why he was being denied exit. The officer shouted at him, insisting that the gentleman had no business knowing why he was being detained despite having no apparent issues with his visa. 



This was a clear indicator for the disrespect and utter negligence that was to follow. 



When it was our turn to approach the counter, my partner and I gave a brief description of our issue: Our marriage process was on hold until the SDM office received clarification specifically from the FRRO about my partner’s passport and visa (the expiration dates are one month apart which is apparently a cause for concern). The SDM office had sent multiple emails to the FRRO over the previous weeks and none had been acknowledged, thus, we were looking to see if there was an unknown issue stalling the process. 



We weren’t even met with eye contact. Furthermore, upon hearing that we were set to be married, the officer asked if we’d applied for a visa conversion. We stated that we had indeed started the process, but that we needed this clarification before the SDM would solemnize our marriage, completing the process. 



The officer briefly glanced at us with disdain before exclaiming loudly to the entire room that we were fools for applying for a visa conversion without completing the marriage first. We tried to explain that although we had indeed started the visa conversion application, the purpose of our visit was to get the clarification that the SDM office had demanded, or at the very least be reassured that the emails had been received and would be replied to, not to convert my partner's visa. 



We pleaded once more that we just needed clarification, simply reassuring us that the SDM office’s emails would be replied to would be sufficient. To this the officer spat, ""Who are you?” followed by “Who are you to ask?”. 



Being treated this deplorably by someone who is supposed to be a public servant, there to assist, was beyond disgusting. My partner and I are simply trying to get married, we just wanted to make sure that there were no unforeseen holdups inhibiting the FRRO office’s reply to the SDM office. 



Deciding that we were no longer worthy of his non-existent assistance, the officer told us to go, flicking his hand to shoo us away. We were dismissed akin to how one might treat a street dog. 



It’s shocking that someone who has hopefully earned his position would treat people in need with such an indifferent attitude. Throughout this whole visit, we were made to feel as though we were inconveniencing the people whose job is to help. 



If your situation has any nuance whatsoever, or you are requesting anything other than a one or two word answer, you should prepare to face a needlessly difficult experience with this agency. 



I certainly hope this situation improves. Public servants, holding positions made to assist people, should not be this disrespectful and unhelpful. I am appalled at how my partner and I were treated at this office. It seems as though seeking basic information or clarification while also being treated with respect is too much for this office to handle. We weren’t looking for special treatment, maintaining basic respect is all that was necessary. 

",173,36,2025-11-07,yag_dev,https://www.reddit.com/r/india/comments/1oqxixz/a_cautionary_tale_for_foreigners_in_india/
india,week,You can build your own air purifier for 2k,"TL;DR – Buy filters from IKEA, buy cabinet exhaust fans or use PC fans, make an enclosure from sunboard or cardboard. Caveats and test details below build.

  
[https://postimg.cc/gallery/5jMZjHQ](https://postimg.cc/gallery/5jMZjHQ)

  
Commercial air purifiers are expensive & bulky, with unnecessary features and costly/unreliable spares. Its quite easy to DIY one for much cheaper.

You will need - 

* Filters - I recommend 2x IKEA FÖRNUFTIG or UPPÅTVIND air filters, as they are incredibly cost effective and you can get replacements easily. These are EPA-12 filters, not H13 – but are perfectly adequate. They will take slightly longer to clean the room, but won’t stress the fans as much, and will live longer. For reference, H13 filters remove 99.95% of particles as small as 0.3 microns. EPA 12 filters remove 99.5%.
* Fans - I got a ""cabinet cooling fan system"" from amazon, since it comes with a power supply and a metal frontplate. But you can also use PC case fans.
* The structure - Cardboard or sunboard is easiest. I used some spare wood for the edges, but its not really necessary. Decent cardboard is sturdy enough.

  
Try to seal the sides and the bottom as best as possible. Use hot glue or tape.

You can also make a single filter or quad filter version, but IMO 2 filters are good enough and also don't take up as much space.

This idea isn’t new. Similar purifiers called CR boxes were popular during COVID. This design builds upon those. However, box fans are not as easily available in India, and neither are furnace filters. This is a cheap and space saving build with components easy to source in India (at home).

  
I also made an AQI monitor using a laser particulate matter sensor and an ESP32.   
I placed the sensor on the opposite side of the room and let it run for a bit, then closed my windows and turned the filter on. The sensor reads PM 1.0, PM 2.5 and PM 10. Readings before the filter was turned on were (35/50/62), and after 20 minutes fell to (17/24/27).

Some screenshots of the monitor log - [https://postimg.cc/gallery/jsjfTdk](https://postimg.cc/gallery/jsjfTdk)  
I would test with a commercial monitor but buying something 3x the cost of the purifier to check if it works doesn't sit right with me.

  
These filters have been running for about 2 months, if I give them a clean or get new ones the results would be better. Also, your results would depend on filter size, fan speed and room size (I ran mine in a room of \~120 sqft).



  
  
FAQs : In anticipation of r/India’s illustrious critics, I have taken the liberty of preparing answers to certain questions I expect.

a. Does it perform as well as a commercial purifier?   
I don't know, but it works and is cheap. If you are allergic to dust or have breathing problems, you would be better off buying a commercial one - knocking the box will make it shed some dust.

  
b. Does it reduce smells?  
No. You will still need to bathe.

  
c. How can you be certain your testing methodology is not flawed?  
I can't. I am a dummy. But I do see dust on the filter so I am pretty sure it works.

  
d. Why wouldn't you just buy one instead of putting in so much effort?  
Because I like to make complicated ramshackle solutions to simple problems.  


e. Why the IKEA filter?  Its not even HEPA-13??? Are you an IKEA shill? >:(  
Yes, yes I am. I love IKEA. They're not even paying me. I do it for free.

  
f. Can you recommend an easier and cheaper air purifier?  
Yes. Wear a mask. Or grow a bushy moustache and allow evolutionary design's own air purifier capture particulate matter before it can make it to your nose.",208,25,2025-11-09,blumune2,https://www.reddit.com/r/india/comments/1osnh73/you_can_build_your_own_air_purifier_for_2k/
india,week,We were ahead of China 35 years ago...,"In 1990, India’s per capita income was higher than China’s. Three decades later, China’s income is 5x higher than India’s.

What has changed? I have a few ideas

+ China’s manufacturing revolution
In 1990, China’s per capita income was $318 vs India’s $368.
But in the next 35 years, China opened up its economy, liberalized markets, and became the factory of the world.

By 2019, China’s per capita income crossed $10,000 while India’s was just one-fifth of that. China didn’t just make cheap products, it built world-class infrastructure, attracted global manufacturing, and became the backbone of Western supply chains.

+ All of this while India missed it's manufacturing moment
China scaled factories and we stayed cautious, and in doing so we missed the early manufacturing wave due to weak infrastructure, red tape, and lack of large-scale industrial push.

So where did India shine? Services exports. In 2018, China’s services exports were $233.6B, India’s were $205B; nearly at par.

This success was largely led by visionary software entrepreneurs, who built companies that served the world long before the term startups was cool. They saw opportunity, and the government did its job by not interfering, and that gave birth to India’s IT revolution. China mastered scale in manufacturing, while we mastered skill in services. 


I feel the next decade is about combining both:

Make in India co-powered by Skill in India.






[India per capita income VS China per capita income](https://theprint.in/pageturner/excerpt/1990-last-time-india-was-ahead-of-china-per-person-income-data/2452689/?utm_source=chatgpt.com)

[China Manufacturing Leaders](https://sccei.fsi.stanford.edu/china-briefs/who-next-china-labor-intensive-manufacturing-so-far-china?utm_source=chatgpt.com)

[Tale of 2 economies](https://www.livemint.com/news/india/the-tale-of-two-economies-what-changed-in-30-years-11592930762996.html)

[India's rise in service exports](https://www.business-standard.com/industry/news/software-services-export-grows-to-205-2-bn-in-fy24-us-major-destination-124101801218_1.html?utm_source=chatgpt.com)",0,15,2025-11-07,kathuriasanjay,https://www.reddit.com/r/india/comments/1oqqw3t/we_were_ahead_of_china_35_years_ago/
india,week,help me finish my semester,"
Hi, I'm Dhyey, a first-year Computer Engineering student at a tier-3 college in India, passionate about AI, machine learning, and building innovative fintech solutions.Coming from a modest family background where my parents work hard to support us, I've always dreamed of turning my tech skills into a career that helps others through smart financial tools, but rising tuition costs are putting my education at risk right now.This fundraiser is for me, a dedicated 18-year-old determined to stay in college and graduate on time despite financial hurdles that many Indian students face.

I need the funds urgently—before the end of this month (November 2025), when my next semester fees are due, or I might have to drop out and delay my studies by a year.The total amount I'm raising is ₹20,000, which will go directly to paying my tuition and exam fees at college, covering essentials like lab access and course materials without any other expenses.With this support, I can focus on my classes, complete projects like coding trading algorithms and ML models on Google Colab, and keep building Gloqont to provide real value in India's growing fintech space.

Your donation, even small like ₹100 or ₹500, will help me continue learning and one day create apps that make finance accessible for everyone, just like I'm trying to do for myself.Thank you for believing in a student's journey—every bit brings me closer to my degree and dreams.

I've attached the link below:
http://m-lp.co/dhyeypat?utm_medium=campaign_page_share&utm_source=copy
",3,11,2025-11-07,PrimeEclipsar,https://www.reddit.com/r/india/comments/1or1lba/help_me_finish_my_semester/
